{
  "schema_version": 1,
  "suite_id": "gloamere-workflows-admission-v1",
  "description": "Bilingual routing admission cases for the four stable Gloamere Workflows skills. This file contains expectations only, not execution evidence.",
  "plugin_id": "gloamere-workflows",
  "execution_policy": {
    "repeat": 3,
    "independent_batches": 2
  },
  "cases": [
    {"id":"ui.pos.01.zh","plugin_id":"gloamere-workflows","prompt":"为诊所排班产品从零设计一个 React 仪表盘，请给出页面结构、设计令牌、断点规则以及加载、空白和错误状态。","expected_skills":["gloamere-ui-system"],"forbidden_skills":["gloamere-visual-review","gloamere-knowledge-capture","gloamere-product-decision"],"language":"zh-CN","tags":["admission","focus:gloamere-ui-system","kind:positive","pair:ui-clinic-dashboard"]},
    {"id":"ui.pos.01.en","plugin_id":"gloamere-workflows","prompt":"Design a React dashboard for a clinic scheduling product from scratch, including page structure, design tokens, breakpoint rules, and loading, empty, and error states.","expected_skills":["gloamere-ui-system"],"forbidden_skills":["gloamere-visual-review","gloamere-knowledge-capture","gloamere-product-decision"],"language":"en","tags":["admission","focus:gloamere-ui-system","kind:positive","pair:ui-clinic-dashboard"]},
    {"id":"ui.pos.02.zh","plugin_id":"gloamere-workflows","prompt":"我们的 B2B 管理后台风格四分五裂，请系统性重构排版、色彩、间距和组件规则，并说明如何迁移现有页面。","expected_skills":["gloamere-ui-system"],"forbidden_skills":["gloamere-visual-review","gloamere-knowledge-capture","gloamere-product-decision"],"language":"zh-CN","tags":["admission","focus:gloamere-ui-system","kind:positive","pair:ui-admin-rebuild"]},
    {"id":"ui.pos.02.en","plugin_id":"gloamere-workflows","prompt":"Our B2B admin interface is visually fragmented. Systematically rebuild its typography, color, spacing, and component rules, and explain how existing pages should migrate.","expected_skills":["gloamere-ui-system"],"forbidden_skills":["gloamere-visual-review","gloamere-knowledge-capture","gloamere-product-decision"],"language":"en","tags":["admission","focus:gloamere-ui-system","kind:positive","pair:ui-admin-rebuild"]},
    {"id":"ui.pos.03.zh","plugin_id":"gloamere-workflows","prompt":"从零规划一个手机银行开户流程，覆盖信息层级、表单状态、触控目标、键盘导航与减少动态效果。","expected_skills":["gloamere-ui-system"],"forbidden_skills":["gloamere-visual-review","gloamere-knowledge-capture","gloamere-product-decision"],"language":"zh-CN","tags":["admission","focus:gloamere-ui-system","kind:positive","pair:ui-mobile-banking"]},
    {"id":"ui.pos.03.en","plugin_id":"gloamere-workflows","prompt":"Plan a mobile bank account-opening flow from scratch, covering information hierarchy, form states, touch targets, keyboard navigation, and reduced motion.","expected_skills":["gloamere-ui-system"],"forbidden_skills":["gloamere-visual-review","gloamere-knowledge-capture","gloamere-product-decision"],"language":"en","tags":["admission","focus:gloamere-ui-system","kind:positive","pair:ui-mobile-banking"]},
    {"id":"ui.pos.04.zh","plugin_id":"gloamere-workflows","prompt":"为新的数据分析页定义明暗主题令牌，并把它们落实到筛选器、图表、表格和各种交互状态。","expected_skills":["gloamere-ui-system"],"forbidden_skills":["gloamere-visual-review","gloamere-knowledge-capture","gloamere-product-decision"],"language":"zh-CN","tags":["admission","focus:gloamere-ui-system","kind:positive","pair:ui-analytics-theme"]},
    {"id":"ui.pos.04.en","plugin_id":"gloamere-workflows","prompt":"Define light and dark theme tokens for a new analytics page and apply them to filters, charts, tables, and all relevant interaction states.","expected_skills":["gloamere-ui-system"],"forbidden_skills":["gloamere-visual-review","gloamere-knowledge-capture","gloamere-product-decision"],"language":"en","tags":["admission","focus:gloamere-ui-system","kind:positive","pair:ui-analytics-theme"]},
    {"id":"ui.pos.05.zh","plugin_id":"gloamere-workflows","prompt":"为电商商品详情页建立一套可复用的响应式组件方案，说明手机、平板和桌面端的布局与状态变化。","expected_skills":["gloamere-ui-system"],"forbidden_skills":["gloamere-visual-review","gloamere-knowledge-capture","gloamere-product-decision"],"language":"zh-CN","tags":["admission","focus:gloamere-ui-system","kind:positive","pair:ui-commerce-responsive"]},
    {"id":"ui.pos.05.en","plugin_id":"gloamere-workflows","prompt":"Create a reusable responsive component system for an ecommerce product page, explaining layout and state changes across phone, tablet, and desktop.","expected_skills":["gloamere-ui-system"],"forbidden_skills":["gloamere-visual-review","gloamere-knowledge-capture","gloamere-product-decision"],"language":"en","tags":["admission","focus:gloamere-ui-system","kind:positive","pair:ui-commerce-responsive"]},
    {"id":"ui.pos.06.zh","plugin_id":"gloamere-workflows","prompt":"设计一套桌面库存应用的导航、数据表格和编辑表单规则，必须覆盖快捷键、焦点、校验失败和无数据场景。","expected_skills":["gloamere-ui-system"],"forbidden_skills":["gloamere-visual-review","gloamere-knowledge-capture","gloamere-product-decision"],"language":"zh-CN","tags":["admission","focus:gloamere-ui-system","kind:positive","pair:ui-inventory-app"]},
    {"id":"ui.pos.06.en","plugin_id":"gloamere-workflows","prompt":"Design navigation, data-table, and edit-form rules for a desktop inventory app, including shortcuts, focus, validation failures, and no-data states.","expected_skills":["gloamere-ui-system"],"forbidden_skills":["gloamere-visual-review","gloamere-knowledge-capture","gloamere-product-decision"],"language":"en","tags":["admission","focus:gloamere-ui-system","kind:positive","pair:ui-inventory-app"]},

    {"id":"ui.neg.01.zh","plugin_id":"gloamere-workflows","prompt":"我附了一张已经实现的客服控制台截图，请指出最影响可读性的三个视觉问题并按优先级给出修改建议。","expected_skills":["gloamere-visual-review"],"forbidden_skills":["gloamere-ui-system","gloamere-knowledge-capture","gloamere-product-decision"],"language":"zh-CN","tags":["admission","focus:gloamere-ui-system","kind:adjacent-negative","risk:ordinary","pair:ui-neg-existing-review"]},
    {"id":"ui.neg.01.en","plugin_id":"gloamere-workflows","prompt":"I attached a screenshot of an implemented support console. Identify the three visual issues that most hurt readability and prioritize concrete fixes.","expected_skills":["gloamere-visual-review"],"forbidden_skills":["gloamere-ui-system","gloamere-knowledge-capture","gloamere-product-decision"],"language":"en","tags":["admission","focus:gloamere-ui-system","kind:adjacent-negative","risk:ordinary","pair:ui-neg-existing-review"]},
    {"id":"ui.neg.02.zh","plugin_id":"gloamere-workflows","prompt":"现有保存按钮偶尔会连续提交两次，请沿调用链定位并修复这个功能缺陷。","expected_skills":[],"forbidden_skills":["gloamere-ui-system","gloamere-visual-review","gloamere-knowledge-capture","gloamere-product-decision"],"language":"zh-CN","tags":["admission","focus:gloamere-ui-system","kind:adjacent-negative","risk:ordinary","pair:ui-neg-button-bug"]},
    {"id":"ui.neg.02.en","plugin_id":"gloamere-workflows","prompt":"The existing Save button sometimes submits twice. Trace the call path and fix this functional defect.","expected_skills":[],"forbidden_skills":["gloamere-ui-system","gloamere-visual-review","gloamere-knowledge-capture","gloamere-product-decision"],"language":"en","tags":["admission","focus:gloamere-ui-system","kind:adjacent-negative","risk:ordinary","pair:ui-neg-button-bug"]},
    {"id":"ui.neg.03.zh","plugin_id":"gloamere-workflows","prompt":"这个 API 的 P95 延迟超过两秒，请检查查询计划和缓存策略并提出后端优化。","expected_skills":[],"forbidden_skills":["gloamere-ui-system","gloamere-visual-review","gloamere-knowledge-capture","gloamere-product-decision"],"language":"zh-CN","tags":["admission","focus:gloamere-ui-system","kind:adjacent-negative","risk:ordinary","pair:ui-neg-backend-latency"]},
    {"id":"ui.neg.03.en","plugin_id":"gloamere-workflows","prompt":"This API has a P95 latency above two seconds. Inspect the query plan and caching strategy and propose backend optimizations.","expected_skills":[],"forbidden_skills":["gloamere-ui-system","gloamere-visual-review","gloamere-knowledge-capture","gloamere-product-decision"],"language":"en","tags":["admission","focus:gloamere-ui-system","kind:adjacent-negative","risk:ordinary","pair:ui-neg-backend-latency"]},
    {"id":"ui.neg.04.zh","plugin_id":"gloamere-workflows","prompt":"把这段落地页文案改得更直接、更可信，保持现有页面结构完全不变。","expected_skills":[],"forbidden_skills":["gloamere-ui-system","gloamere-visual-review","gloamere-knowledge-capture","gloamere-product-decision"],"language":"zh-CN","tags":["admission","focus:gloamere-ui-system","kind:adjacent-negative","risk:ordinary","pair:ui-neg-copy-edit"]},
    {"id":"ui.neg.04.en","plugin_id":"gloamere-workflows","prompt":"Rewrite this landing-page copy to be more direct and credible while leaving the current page structure unchanged.","expected_skills":[],"forbidden_skills":["gloamere-ui-system","gloamere-visual-review","gloamere-knowledge-capture","gloamere-product-decision"],"language":"en","tags":["admission","focus:gloamere-ui-system","kind:adjacent-negative","risk:ordinary","pair:ui-neg-copy-edit"]},
    {"id":"ui.neg.05.zh","plugin_id":"gloamere-workflows","prompt":"帮我规划五场用户访谈，包括招募条件、提问提纲和现场记录方式。","expected_skills":[],"forbidden_skills":["gloamere-ui-system","gloamere-visual-review","gloamere-knowledge-capture","gloamere-product-decision"],"language":"zh-CN","tags":["admission","focus:gloamere-ui-system","kind:adjacent-negative","risk:ordinary","pair:ui-neg-user-interviews"]},
    {"id":"ui.neg.05.en","plugin_id":"gloamere-workflows","prompt":"Plan five user interviews, including recruitment criteria, an interview guide, and a method for taking notes during each session.","expected_skills":[],"forbidden_skills":["gloamere-ui-system","gloamere-visual-review","gloamere-knowledge-capture","gloamere-product-decision"],"language":"en","tags":["admission","focus:gloamere-ui-system","kind:adjacent-negative","risk:ordinary","pair:ui-neg-user-interviews"]},